{
  "meta": {
    "version": "1.0",
    "source": "VS6 - Aventurische Namen.pdf",
    "culture": "Ferkina",
    "key": "ferkina",
    "extraction": {
      "kind": "chapter",
      "hint": "16 Ferkina",
      "note": "Stammesnamen with Ban/Bern/Ulad included as tribe names; iban/sabu used as patronymic particles."
    }
  },
  "rules": {
    "gender_modes": [
      "female",
      "male"
    ],
    "name_patterns": [
      {
        "id": "common_f_only",
        "template": "{given_f}",
        "usage": [
          "common"
        ]
      },
      {
        "id": "common_m_only",
        "template": "{given_m}",
        "usage": [
          "common"
        ]
      },
      {
        "id": "tribal_f",
        "template": "{given_f} {tribe}",
        "usage": [
          "common",
          "tribal"
        ]
      },
      {
        "id": "tribal_m",
        "template": "{given_m} {tribe}",
        "usage": [
          "common",
          "tribal"
        ]
      },
      {
        "id": "pat_m_iban",
        "template": "{given_m} {generic_particle} {given_m}",
        "usage": [
          "patronymic",
          "common"
        ],
        "allowed_generic_particles": [
          "iban"
        ]
      },
      {
        "id": "pat_f_iban",
        "template": "{given_f} {generic_particle} {given_m}",
        "usage": [
          "patronymic",
          "common"
        ],
        "allowed_generic_particles": [
          "iban"
        ]
      },
      {
        "id": "pat_f_sabu",
        "template": "{given_f} {generic_particle} {given_m}",
        "usage": [
          "patronymic",
          "common"
        ],
        "allowed_generic_particles": [
          "sabu"
        ]
      },
      {
        "id": "tribe_only",
        "template": "{tribe}",
        "usage": [
          "tribal",
          "standalone"
        ]
      }
    ],
    "pattern_weights": {
      "common_f_only": 4,
      "common_m_only": 4,
      "tribal_f": 4,
      "tribal_m": 4,
      "pat_m_iban": 2,
      "pat_f_iban": 1,
      "pat_f_sabu": 2,
      "tribe_only": 1
    },
    "particles": {
      "noble": [],
      "generic": [
        "iban",
        "sabu"
      ]
    },
    "transforms": {
      "diminutives": {
        "female_suffixes": [],
        "male_suffixes": []
      }
    },
    "patronymic": {
      "enabled": true,
      "male_patterns": [
        "pat_m_iban"
      ],
      "female_patterns": [
        "pat_f_iban",
        "pat_f_sabu"
      ]
    }
  },
  "lexicon": {
    "given_f": [
      "Ashu",
      "Azrubat",
      "Begum",
      "Belkhara",
      "Chanum",
      "Chatun",
      "Chizuran",
      "Chorjan",
      "Chorshilan",
      "Dscheridocht",
      "Duncha",
      "Farah",
      "Faroshte",
      "Farsha",
      "Farzandeh",
      "Golbanu",
      "Golsban",
      "Harshan",
      "Hulya",
      "Jeleyin",
      "Khalila",
      "Khullat",
      "Laal",
      "Lahileh",
      "Massudeh",
      "Mehrshan",
      "Mirhay",
      "Nadam",
      "Nazrin",
      "Nuraya",
      "Nurjahan",
      "Peribanu",
      "Rashadocht",
      "Rohila",
      "Rushan",
      "Shiringol",
      "Shmahba",
      "Sulefin",
      "Tamra",
      "Tarshabet",
      "Tebay",
      "Tulamin",
      "Zarbanu",
      "Zulecha"
    ],
    "given_m": [
      "Abtuul",
      "Ardavan",
      "Ardesh",
      "Azad",
      "Bashur",
      "Burshuk",
      "Chosraw",
      "Devlekh",
      "Djershar",
      "Dschafur",
      "Dschalf",
      "Durjin",
      "Faruch",
      "Farzand",
      "Feridun",
      "Fervez",
      "Gulbad",
      "Hafiz",
      "Harnar",
      "Haydar",
      "Jikhab",
      "Kaszan",
      "Kazh",
      "Kazum",
      "Kherim",
      "Khordad",
      "Madawan",
      "Mharbal",
      "Mirlam",
      "Muyanshir",
      "Nashrath",
      "Rachwan",
      "Rashni",
      "Rasuul",
      "Rustam",
      "Sharkhan",
      "Tsharik",
      "Tugril",
      "Tulsani",
      "Uchrab",
      "Umar",
      "Waqran",
      "Yabman",
      "Yistarrech",
      "Zakhaban",
      "Zhandur"
    ],
    "surnames": [],
    "bynames": [],
    "tribes": [
      "Ban Anghrachan",
      "Ban Awallakh",
      "Ban Farkash",
      "Ban Gassarah",
      "Ban Hadarri",
      "Ban Khalil",
      "Ban Kherash",
      "Ban Malya",
      "Ban Mhadjaduri",
      "Ban Sharida",
      "Ban TirghUfa",
      "Ban Uludh",
      "Bern Chalif",
      "Bern Yashkar",
      "Shai'Aian",
      "Ulad Asuban",
      "Ulad Barshirn",
      "Ulad Yerkash"
    ],
    "sippen": [],
    "honorifics": [],
    "noble_names": [],
    "raw_text": "16Ferkina \n-»Das sind nichts als Wilde, Effendi. Sie färben ihre\nGesichtssch leier mit dem Blut ihrer Feinde, hüllen \n'sich, in Felle, und ihre Körper sind voller Narben. Die \nmeistep davon st�mmen aus dem Kampf, aber sie sol­\nlen sich auch selbst verstümmeln! Ihr solltet keines­\nfalls die Südroute nehmen, wenn ihr ihnen nicht in \nden Ausläufern des Khoramgebirges begegnen wollt. \nIch k�nne einen fähigen Führer, Effendi, der euch hel-\nfen kann -gegen eine kleine Zuwendung.« \n-gehört in einer Karawanserei in Ras El'Bir, 1039 BF \nAuch wenn das Bild von wilden Barbaren vorherrscht, die Karawanen und arglose Reisende überfallen, leben manche Stämme der Ferkinas doch vergleichsweise friedlich als Hirten und Jäger. Damit tun sie es ihren Ahnen, den Urtulamiden, gleich, die sich einst vor der Bedrohung durch die Echsen in den Bergen versteck­ten. Ihre Sitten sind rau, und so künden auch ihre Na­men von der Härte und Stärke, die das Leben ihnen in Raschtulswall, Khoramgebirge und dem Hochland Mha­nadistans abverlangt. üblicherweise tragen Männer und unverheiratete Frauen einen Vaternamen hinter ihrem eigenen. Dieser wird \nmit iban (Sohn des) oder sabu (Tochter des) nach­gestellt. Verheiratete Frauen fügen stattdessen nach ei­nem zawsh(i)-(Besitz von) den Namen des Ehemanns an. Yabmans Frau heißt also Farsha zawshi-Yabman, sein Sohn Ardesh iban Yabman und seine Tochter Laal sabu Yabman. Die Stammesnamen werden meist einem mythischen Stammesgründer, einer besonderen Eigenschaft des Stammes oder einem markanten Ort im Siedlungsgebiet entlehnt. Gebildet werden sie zumeist mit Bdn (Kinder des, gesprochen: Ba-an), seltener einmal auch mit dem gleichbedeutenden Ulad oder Bern.\nHelden & Heilige: Adawadt (Riese im Raschtulswall), Reshalia ai Djer Khalil (blinde Hochgeweihte der Rah­ja in Fasar), Rurech (Stammvater der Beni Rurech, die vor Jahrhunderten das verfluchte Eiland Maraskan be­siedelten), Yabman Pascha (ehemaliger Anführer der Ban Uludh, verhasster Scherge Orons, konnte die Gestalt eines Mannwidders annehmen), Zulha­mid und Zulhamin (legendenumrankte erste Menschen) \nVornamen (w): Ashu, Azrubat, Begum, Belkhara, Chanum, Chatun, Chizuran, Chorjan, Chorshilan, Dscheridocht, Duncha, Farah, Faroshte, Farsha, Farzandeh, Golbanu, Golsban, Harshan, Hulya, Jeleyin, Khalila, Khullat, Laal, Lahileh, Massudeh, Mehrshan, Mirhay, Nadam, Nazrin, Nuraya, Nurjahan, Peribanu, Rashadocht, Rohila, Rushan, Shiringol, Shmahba, Sulefin, Tamra, Tarshabet, Tebay, Tulamin, Zarbanu, Zule(y)cha Vornamen (m): Abtuul, Ardavan, Ardesh, Azad, Bashur, Burshuk, Chosraw, Devlekh, Djershar, Dschafur, Dschalf, Durjin, Faruch, Farzand, Feridun, Fervez, Gulbad, Hafiz, Harnar, Haydar, Jikhab, Kaszan, Kazh, Kazum, Kherim, Khordad, Madawan, Mharbal, Mirlam, Muyanshir, Nash­rath, Rachwan, Rashni, Ras(h)uul, Rustam, Sharkhan, Tsharik, Tugril, Tulsani, Uchrab, Umar, Waqran, Yab­man, Yistarrech, Zakhaban, Zhandur \nStammesnamen der Ferkina: Ban Anghrachan, Ban Awallakh, Ban Farkash, Ban Gassarah, Ban Hadarri, Ban Khalil, Ban Kherash, Ban Malya, Ban Mhadjaduri, Ban Sharida, Ban TirghUfa, Ban Uludh, Bern Chalif, Bern Yashkar, Shai'Aian, Ulad Asuban, Ulad Barshirn, Ulad Yerkash \n"
  }
}